{
  "schema_version": "1.0.0",
  "artifact_type": "policy-decision",
  "id": "PD-0001",
  "created_at": "2026-09-21T12:20:00Z",
  "actor": { "type": "agent", "id": "implementer", "role": "implementer" },
  "run_id": "RUN-implementer-0001",
  "point": "pre-tool-call",
  "decision": "deny",
  "reason_codes": ["TOOL_NOT_IN_ALLOWLIST", "CAPABILITY_SCOPE_VIOLATION"],
  "policy_bundle_version": "0.1.0+sha256:1111111111111111111111111111111111111111111111111111111111111111",
  "input_digest": "bbbbbbbbbbbbbbbbbbbbbbbbbbbbbbbbbbbbbbbbbbbbbbbbbbbbbbbbbbbbbbbb",
  "links": [
    { "rel": "task", "href": "specs/examples/task.json" }
  ]
}
